{
  "schema_version": "1.0",
  "city_id": "4927ea678dbb115a6ab09a017d6dcad73cbf8c938592be5e83159d5235fa8213",
  "run_id": "urbantwin-distributed-demo-002",
  "sequence": 0,
  "timestamp": 0.0,
  "data_kind": "mock",
  "label": "DEMO / MOCK SIMULATION DATA - DISTRIBUTED NORMAL",
  "scenario": {
    "temperature_c": 32,
    "population_equivalent": 50000
  },
  "agents": [
    {
      "id": "citizen_001",
      "x": -15.003,
      "y": -94.308,
      "z": 0.15,
      "route": [
        "edge_1238",
        "edge_1256",
        "edge_1251",
        "edge_1260",
        "edge_1252",
        "edge_1253",
        "edge_1254",
        "edge_1236",
        "edge_1263",
        "edge_1239",
        "edge_1240",
        "edge_1258",
        "edge_1241",
        "edge_1242",
        "edge_1261",
        "edge_1243",
        "edge_1244",
        "edge_1245",
        "edge_1257",
        "edge_1246",
        "edge_1247",
        "edge_1255",
        "edge_1248",
        "edge_1259",
        "edge_1249",
        "edge_1237",
        "edge_1262",
        "edge_1250"
      ],
      "stress": 0.24,
      "heat_exposure": 0.32
    },
    {
      "id": "citizen_002",
      "x": 376.898,
      "y": 346.097,
      "z": 0.15,
      "route": [
        "edge_1190",
        "edge_1191"
      ],
      "stress": 0.24,
      "heat_exposure": 0.32
    },
    {
      "id": "citizen_003",
      "x": 376.413,
      "y": -362.309,
      "z": 0.15,
      "route": [
        "edge_1899",
        "edge_1893",
        "edge_1896",
        "edge_1895",
        "edge_1901",
        "edge_1898",
        "edge_1897",
        "edge_1900",
        "edge_1894"
      ],
      "stress": 0.24,
      "heat_exposure": 0.32
    },
    {
      "id": "citizen_004",
      "x": -375.126,
      "y": 334.502,
      "z": 0.15,
      "route": [
        "edge_828",
        "edge_829"
      ],
      "stress": 0.24,
      "heat_exposure": 0.32
    },
    {
      "id": "citizen_005",
      "x": -372.33,
      "y": -345.24,
      "z": 0.15,
      "route": [
        "edge_1824",
        "edge_1823",
        "edge_1828",
        "edge_1826",
        "edge_1830",
        "edge_1831",
        "edge_1827",
        "edge_1825",
        "edge_1829"
      ],
      "stress": 0.24,
      "heat_exposure": 0.32
    },
    {
      "id": "citizen_006",
      "x": 39.043,
      "y": 387.538,
      "z": 0.15,
      "route": [
        "edge_824",
        "edge_823",
        "edge_822",
        "edge_821",
        "edge_820"
      ],
      "stress": 0.24,
      "heat_exposure": 0.32
    },
    {
      "id": "citizen_007",
      "x": 207.285,
      "y": -109.736,
      "z": 0.15,
      "route": [
        "edge_521",
        "edge_522",
        "edge_523",
        "edge_524",
        "edge_525"
      ],
      "stress": 0.24,
      "heat_exposure": 0.32
    },
    {
      "id": "citizen_008",
      "x": 10.995,
      "y": -386.25,
      "z": 0.15,
      "route": [
        "edge_1034"
      ],
      "stress": 0.24,
      "heat_exposure": 0.32
    },
    {
      "id": "citizen_009",
      "x": -347.178,
      "y": 39.277,
      "z": 0.15,
      "route": [
        "edge_644",
        "edge_646",
        "edge_647",
        "edge_645"
      ],
      "stress": 0.24,
      "heat_exposure": 0.32
    },
    {
      "id": "citizen_010",
      "x": 145.683,
      "y": 184.982,
      "z": 0.15,
      "route": [
        "edge_2017",
        "edge_2024",
        "edge_2019",
        "edge_2022",
        "edge_2021",
        "edge_2025",
        "edge_2026",
        "edge_2023",
        "edge_2018",
        "edge_2020"
      ],
      "stress": 0.24,
      "heat_exposure": 0.32
    },
    {
      "id": "citizen_011",
      "x": -148.586,
      "y": 149.774,
      "z": 0.15,
      "route": [
        "edge_157",
        "edge_158",
        "edge_159",
        "edge_160"
      ],
      "stress": 0.24,
      "heat_exposure": 0.32
    },
    {
      "id": "citizen_012",
      "x": 375.772,
      "y": 51.619,
      "z": 0.15,
      "route": [
        "edge_2169",
        "edge_2170",
        "edge_2171",
        "edge_2172",
        "edge_2173",
        "edge_2174",
        "edge_2175",
        "edge_2176",
        "edge_2168"
      ],
      "stress": 0.24,
      "heat_exposure": 0.32
    },
    {
      "id": "citizen_013",
      "x": -378.054,
      "y": -140.805,
      "z": 0.15,
      "route": [
        "edge_739",
        "edge_738"
      ],
      "stress": 0.24,
      "heat_exposure": 0.32
    },
    {
      "id": "citizen_014",
      "x": 218.202,
      "y": 384.406,
      "z": 0.15,
      "route": [
        "edge_1282",
        "edge_1278",
        "edge_1283",
        "edge_1281",
        "edge_1284",
        "edge_1280",
        "edge_1285",
        "edge_1286",
        "edge_1287",
        "edge_1288",
        "edge_1279",
        "edge_1289",
        "edge_1290"
      ],
      "stress": 0.24,
      "heat_exposure": 0.32
    },
    {
      "id": "citizen_015",
      "x": 77.426,
      "y": -167.383,
      "z": 0.15,
      "route": [
        "edge_372",
        "edge_373",
        "edge_376",
        "edge_371",
        "edge_370",
        "edge_369",
        "edge_368",
        "edge_374",
        "edge_367",
        "edge_366",
        "edge_365",
        "edge_364",
        "edge_363",
        "edge_362",
        "edge_361",
        "edge_375"
      ],
      "stress": 0.24,
      "heat_exposure": 0.32
    },
    {
      "id": "citizen_016",
      "x": 30.451,
      "y": 5.028,
      "z": 0.15,
      "route": [
        "edge_802",
        "edge_800",
        "edge_804",
        "edge_801",
        "edge_803"
      ],
      "stress": 0.24,
      "heat_exposure": 0.32
    },
    {
      "id": "citizen_017",
      "x": 376.373,
      "y": -157.508,
      "z": 0.15,
      "route": [
        "edge_1145",
        "edge_1146",
        "edge_1147",
        "edge_1148",
        "edge_1149",
        "edge_1150",
        "edge_1151",
        "edge_1152"
      ],
      "stress": 0.24,
      "heat_exposure": 0.32
    },
    {
      "id": "citizen_018",
      "x": -114.664,
      "y": -225.359,
      "z": 0.15,
      "route": [
        "edge_695",
        "edge_696",
        "edge_697"
      ],
      "stress": 0.24,
      "heat_exposure": 0.32
    },
    {
      "id": "citizen_019",
      "x": -214.361,
      "y": 384.649,
      "z": 0.15,
      "route": [
        "edge_291",
        "edge_289",
        "edge_290"
      ],
      "stress": 0.24,
      "heat_exposure": 0.32
    },
    {
      "id": "citizen_020",
      "x": -291.059,
      "y": 197.258,
      "z": 0.15,
      "route": [
        "edge_285",
        "edge_284",
        "edge_288",
        "edge_286",
        "edge_287"
      ],
      "stress": 0.24,
      "heat_exposure": 0.32
    },
    {
      "id": "citizen_021",
      "x": 33.119,
      "y": -111.742,
      "z": 0.15,
      "route": [
        "edge_768",
        "edge_769"
      ],
      "stress": 0.24,
      "heat_exposure": 0.32
    },
    {
      "id": "citizen_022",
      "x": -257.281,
      "y": -36.98,
      "z": 0.15,
      "route": [
        "edge_719",
        "edge_720",
        "edge_724",
        "edge_721",
        "edge_722",
        "edge_723"
      ],
      "stress": 0.24,
      "heat_exposure": 0.32
    },
    {
      "id": "citizen_023",
      "x": -203.901,
      "y": -209.966,
      "z": 0.15,
      "route": [
        "edge_2229"
      ],
      "stress": 0.24,
      "heat_exposure": 0.32
    },
    {
      "id": "citizen_024",
      "x": -6.195,
      "y": 192.249,
      "z": 0.15,
      "route": [
        "edge_863",
        "edge_860",
        "edge_861",
        "edge_862"
      ],
      "stress": 0.24,
      "heat_exposure": 0.32
    },
    {
      "id": "citizen_025",
      "x": -72.433,
      "y": -14.252,
      "z": 0.15,
      "route": [
        "edge_1238",
        "edge_1256",
        "edge_1251",
        "edge_1260",
        "edge_1252",
        "edge_1253",
        "edge_1254",
        "edge_1236",
        "edge_1263",
        "edge_1239",
        "edge_1240",
        "edge_1258",
        "edge_1241",
        "edge_1242",
        "edge_1261",
        "edge_1243",
        "edge_1244",
        "edge_1245",
        "edge_1257",
        "edge_1246",
        "edge_1247",
        "edge_1255",
        "edge_1248",
        "edge_1259",
        "edge_1249",
        "edge_1237",
        "edge_1262",
        "edge_1250"
      ],
      "stress": 0.24,
      "heat_exposure": 0.32
    },
    {
      "id": "citizen_026",
      "x": 369.291,
      "y": 342.647,
      "z": 0.15,
      "route": [
        "edge_1190",
        "edge_1191"
      ],
      "stress": 0.24,
      "heat_exposure": 0.32
    },
    {
      "id": "citizen_027",
      "x": 367.998,
      "y": -367.203,
      "z": 0.15,
      "route": [
        "edge_1899",
        "edge_1893",
        "edge_1896",
        "edge_1895",
        "edge_1901",
        "edge_1898",
        "edge_1897",
        "edge_1900",
        "edge_1894"
      ],
      "stress": 0.24,
      "heat_exposure": 0.32
    },
    {
      "id": "citizen_028",
      "x": -364.663,
      "y": 342.496,
      "z": 0.15,
      "route": [
        "edge_828",
        "edge_829"
      ],
      "stress": 0.24,
      "heat_exposure": 0.32
    },
    {
      "id": "citizen_029",
      "x": -354.968,
      "y": -344.433,
      "z": 0.15,
      "route": [
        "edge_1824",
        "edge_1823",
        "edge_1828",
        "edge_1826",
        "edge_1830",
        "edge_1831",
        "edge_1827",
        "edge_1825",
        "edge_1829"
      ],
      "stress": 0.24,
      "heat_exposure": 0.32
    },
    {
      "id": "citizen_030",
      "x": 25.446,
      "y": 382.055,
      "z": 0.15,
      "route": [
        "edge_824",
        "edge_823",
        "edge_822",
        "edge_821",
        "edge_820"
      ],
      "stress": 0.24,
      "heat_exposure": 0.32
    },
    {
      "id": "citizen_031",
      "x": 231.53,
      "y": -96.25,
      "z": 0.15,